{
    "$schema": "http://json-schema.org/draft-07/schema#",
    "title": "Note",
    "type": "object",
    "properties": {
        "id": {
        "type": "integer"
        },
        "title": {
        "type": "string"
        },
        "content": {
        "type": "string"
        },
        "tags": {
            "type": "array",
            "items": {
                "type": "string"
            }
        }
    },
    "required": ["id", "title", "content", "tags"]
}