[
    {
        "title": "Books to Read",
        "content": "The Alchemist Educated by Tara asdasdasd",
        "tags": [
            "books",
            "dadadad"
        ],
        "id": 1
    },
    {
        "title": "Books to Read",
        "content": "The Alchemist Educated by Tara",
        "tags": [
            "books",
            "dadadad"
        ],
        "id": 2
    }
]